{"$schema":"https://json-schema.org/draft/2020-12/schema","additionalProperties":false,"properties":{"accepted_freeze_authority_identity":{"pattern":"^[0-9a-f]{64}$","type":"string"},"accepted_freeze_receipt_identity":{"pattern":"^[0-9a-f]{64}$","type":"string"},"append_only_algorithm":{"minLength":1,"type":"string"},"append_only_root":{"pattern":"^[0-9a-f]{64}$","type":"string"},"authority_id":{"minLength":1,"type":"string"},"authority_type":{"const":"observer_source_authority"},"authorized_package_path":{"pattern":"^[^:]+$","type":"string"},"event_source_implementation_identity":{"minLength":1,"type":"string"},"expected_event_sequence":{"items":{"minLength":1,"type":"string"},"minItems":1,"type":"array"},"initial_root":{"pattern":"^[0-9a-f]{64}$","type":"string"},"reader_implementation_identity":{"minLength":1,"type":"string"},"schema_version":{"const":"6.0.0-DRAFT"},"source_cutoff_sequence":{"minimum":1,"type":"integer"},"source_cutoff_timestamp":{"format":"date-time","type":"string"},"source_id":{"minLength":1,"type":"string"},"source_issuance_event":{"minLength":1,"type":"string"},"source_raw_sha256":{"pattern":"^[0-9a-f]{64}$","type":"string"},"source_schema":{"minLength":1,"type":"string"},"source_start_sequence":{"minimum":1,"type":"integer"},"source_start_timestamp":{"format":"date-time","type":"string"},"source_type":{"enum":["APPEND_ONLY_JSONL"],"type":"string"},"timestamp_authority_identity":{"pattern":"^[0-9a-f]{64}$","type":"string"}},"required":["accepted_freeze_authority_identity","accepted_freeze_receipt_identity","append_only_algorithm","append_only_root","authority_id","authority_type","authorized_package_path","event_source_implementation_identity","expected_event_sequence","initial_root","reader_implementation_identity","schema_version","source_cutoff_sequence","source_cutoff_timestamp","source_id","source_issuance_event","source_raw_sha256","source_schema","source_start_sequence","source_start_timestamp","source_type","timestamp_authority_identity"],"title":"R4 observer source authority","type":"object"}
