{"accepted_freeze_authority_identity":"9cd2e65119e8fe3613f2e4a148f3d0b43117331133c157f8c670b6993ee62571","accepted_freeze_receipt_identity":"9cd2e65119e8fe3613f2e4a148f3d0b43117331133c157f8c670b6993ee62571","append_only_algorithm":"RANDLE-CAPTURE-CJSON-CHAIN-1","append_only_root":"7c8473b9dc701f46232434938bd96158978f5f3d8ec412a8bc75556a8efbcd8e","authority_id":"RANDLE-R4-OBSERVER-SOURCE-1","authority_type":"observer_source_authority","authorized_package_path":"Architecture/Audits/2026-07-21_Current_Production_Baseline_Capture_Boundary_Specification_DRAFT/observer_event_source_R4_DRAFT.jsonl","event_source_implementation_identity":"RANDLE-R4-FILESYSTEM-WATCHER-EVENT-SOURCE-1","expected_event_sequence":["WRITER_ACTIVITY","RUNTIME_OPERATION","DEPLOYMENT_ATTEMPT","RESTART_ATTEMPT","BRANCH_MOVEMENT","INDEX_MOVEMENT"],"initial_root":"0000000000000000000000000000000000000000000000000000000000000000","reader_implementation_identity":"RANDLE-R4-GOVERNED-EVENT-READER-1","schema_version":"6.0.0-DRAFT","source_cutoff_sequence":6,"source_cutoff_timestamp":"2026-07-22T11:11:00Z","source_id":"RANDLE-R4-OBSERVER-SOURCE-1","source_issuance_event":"RANDLE-R4-OBSERVER-ISSUED-1","source_raw_sha256":"0d463ae9344905f1b2a9061cdafe62479715dc7a6cd4412514d047e163d8aeaa","source_schema":"observer_event_R4_schema_DRAFT.json","source_start_sequence":1,"source_start_timestamp":"2026-07-22T11:06:00Z","source_type":"APPEND_ONLY_JSONL","timestamp_authority_identity":"2ba3f99b825f322249a3cd3250719b4d08b5cf1e933ed1506d85c16968938b08"}
